{
  "schema_version": "groundsignal.research-eval-policy.v1",
  "k": 10,
  "min_reference_groups": 3,
  "min_labeled_claims": 100,
  "min_retrieval_recall": 0.8,
  "min_extraction_precision": 0.95,
  "min_end_to_end_recall": 0.8,
  "min_rank_judgment_coverage": 0.8,
  "min_candidate_label_coverage": 1,
  "min_human_review_coverage": 1,
  "high_risk_human_reviewers": 2
}
